Millennium Globalny Akcji (Millennium SFIO)	155,65	PLN	0,30	0,15	0,28	2,10	12,57	18,40	2017-07-25	
Millennium Globalny Akcji (USD) (Millennium SFIO)	42,62	USD	-0,05	0,00	3,85	8,67	22,37	-0,05	2017-07-25	-
Millennium Globalny Stabilnego Wzrostu (EUR) (Millennium SFIO)	45,14	EUR	-0,22	-1,10	-0,57	0,47	6,39	6,87	2017-07-25	-
Millennium Globalny Stabilnego Wzrostu (Millennium SFIO)	192,11	PLN	0,13	0,14	0,14	0,98	3,84	9,71	2017-07-25	
Millennium Globalny Stabilnego Wzrostu (USD) (Millennium SFIO)	52,61	USD	-0,21	0,02	3,73	7,50	12,87	-7,38	2017-07-25	-
Millennium Globalny Strategii Alternatywnych (EUR) (Millennium SFIO)	25,55	EUR	0,08	-0,97	0,20	-0,43	1,43	-12,23	2017-07-25	-
Millennium Globalny Strategii Alternatywnych (Millennium SFIO)	108,75	PLN	0,42	0,28	0,92	0,06	-0,97	-9,89	2017-07-25	-
Millennium Globalny Strategii Alternatywnych (USD) (Millennium SFIO)	29,78	USD	0,10	0,13	4,53	6,51	7,66	-23,91	2017-07-25	-
Millennium Instrumentów Dłużnych (Millennium FIO)	108,80	PLN	-0,01	0,06	0,41	0,95	5,26	0,00	2017-07-25	-
Millennium Konserwatywny (Millennium SFIO)	101,13	PLN	-0,10	-0,19	-0,50	-0,09	0,00	0,00	2017-07-25	-
Millennium Obligacji Korporacyjnych (EUR) (Millennium SFIO)	32,80	EUR	-0,33	-1,18	-0,39	0,28	6,63	6,22	2017-07-25	-
Millennium Obligacji Korporacyjnych (Millennium SFIO)	139,59	PLN	0,01	0,07	0,32	0,77	4,07	9,03	2017-07-25	
Millennium Obligacji Korporacyjnych (USD) (Millennium SFIO)	38,22	USD	-0,34	-0,08	3,89	7,27	13,11	-7,97	2017-07-25	-
Millennium Stabilnego Wzrostu (Millennium FIO)	148,69	PLN	0,03	-0,32	-0,15	0,10	8,46	5,81	2017-07-25	
MM Prime Depozytowy FIZ	1 125,26	PLN	0,00	0,11	0,39	1,11	3,97	0,00	2017-07-26	
MM Prime Dynamiczny FIZ	1 294,06	PLN	0,00	-0,79	0,50	1,99	30,66	0,00	2017-07-26	-
MS Akcji (MS Parasolowy FIO)	103,20	PLN	0,36	0,16	2,56	1,09	0,00	0,00	2017-07-25	-
MS Obligacji (MS Parasolowy FIO)	101,32	PLN	0,01	-0,02	0,31	0,98	0,00	0,00	2017-07-25	-
MS Płynnościowy (MS Parasolowy FIO)	100,60	PLN	0,00	0,02	0,08	0,27	0,00	0,00	2017-07-25	-
Murapol HRE FIZ AN	100,00	PLN	0,00	0,00	0,00	0,00	0,00	0,00	2017-07-26	-
NN (L) Ameryki Łacińskiej (NN SFIO)	66,71	PLN	-0,45	-0,42	6,14	4,25	11,41	-22,12	2017-07-26	-
NN (L) Depozytowy (NN SFIO)	115,11	PLN	0,00	0,02	0,16	0,39	1,28	3,78	2017-07-26	
NN (L) Dynamiczny Globalnej Alokacji (NN SFIO)	160,21	PLN	0,11	-0,22	-1,29	-0,23	4,49	0,00	2017-07-26	-
NN (L) Europejski Spółek Dywidendowych (NN SFIO)	167,01	PLN	0,35	-0,57	-0,64	0,58	16,90	7,22	2017-07-26	
NN (L) Globalny Długu Korporacyjnego (NN SFIO)	176,81	PLN	0,10	0,33	1,02	1,46	8,02	9,28	2017-07-26	
NN (L) Globalny Spółek Dywidendowych (NN SFIO)	218,95	PLN	0,22	-0,65	-1,69	-3,62	9,75	24,17	2017-07-26	
NN (L) Japonia (NN SFIO)	189,25	PLN	0,23	-0,41	1,14	4,41	24,19	19,73	2017-07-26	-
NN (L) Multi Asset Factor Opportunities FIZ	9,93	PLN	0,00	0,00	-0,20	0,00	0,00	0,00	2017-07-26	-
NN (L) Nowej Azji (NN SFIO)	127,57	PLN	-0,30	0,19	1,15	6,67	16,13	6,09	2017-07-26	
NN (L) Obligacji Rynków Wschodzących (Waluta Lokalna) (NN SFIO)	94,92	PLN	-0,01	-0,43	0,54	3,30	6,68	-12,40	2017-07-26	-
NN (L) Obligacyjny Globalnej Alokacji (NN SFIO)	110,28	PLN	-0,07	-0,33	-0,89	-0,10	1,87	0,00	2017-07-26	
NN (L) Senior Loans FIZ	11,10	PLN	0,09	0,18	0,45	0,54	3,93	9,58	2017-07-26	
NN (L) Spółek Dywidendowych Rynków Wschodzących (NN SFIO)	115,27	PLN	0,30	-0,90	0,37	0,07	15,69	10,40	2017-07-26	
NN (L) Spółek Dywidendowych USA (NN SFIO)	192,51	PLN	-0,60	-0,08	1,42	1,01	10,61	11,86	2017-07-26	
NN (L) Stabilny Globalnej Alokacji (NN SFIO)	119,27	PLN	0,08	-0,13	-0,62	-0,19	2,46	12,90	2017-07-26	-
NN (L) Stabilny Globalnej Alokacji EUR (EUR) (NN SFIO)	104,26	EUR	0,06	-0,16	-0,76	-0,70	0,19	0,00	2017-07-26	-
NN Akcji (NN FIO)	347,66	PLN	0,53	0,07	1,88	0,73	30,64	24,55	2017-07-26	
NN Akcji Środkowoeuropejskich (NN FIO)	185,74	PLN	0,49	-0,05	3,04	6,55	25,58	15,47	2017-07-26	
NN Gotówkowy (NN FIO)	263,63	PLN	0,01	0,02	0,16	0,40	1,28	3,99	2017-07-26	
NN Lokacyjny Plus (NN FIO)	126,11	PLN	0,04	0,06	0,21	0,72	2,76	7,08	2017-07-26	
NN Obligacji (NN FIO)	298,52	PLN	-0,03	-0,09	-0,06	1,33	2,50	8,50	2017-07-26	
NN Perspektywa 2020 (NN Perspektywa SFIO)	126,46	PLN	0,06	-0,07	0,17	0,89	5,20	7,96	2017-07-26	-
NN Perspektywa 2025 (NN Perspektywa SFIO)	130,30	PLN	0,10	-0,12	0,32	1,15	8,19	10,23	2017-07-26	-
NN Perspektywa 2030 (NN Perspektywa SFIO)	129,78	PLN	0,14	-0,14	0,40	1,22	9,33	10,42	2017-07-26	-
NN Perspektywa 2035 (NN Perspektywa SFIO)	130,03	PLN	0,16	-0,16	0,46	1,25	10,36	10,64	2017-07-26	-
NN Perspektywa 2040 (NN Perspektywa SFIO)	129,57	PLN	0,19	-0,18	0,54	1,28	11,46	10,66	2017-07-26	-
NN Perspektywa 2045 (NN Perspektywa SFIO)	129,58	PLN	0,22	-0,18	0,61	1,35	12,51	11,40	2017-07-26	-
NN SFIO Akcji 2	432,09	PLN	0,53	-0,07	1,74	1,21	32,50	25,96	2017-07-26	
NN SFIO Obligacji 2	279,77	PLN	-0,07	-0,14	-0,12	1,04	2,46	0,00	2017-07-26	
NN Średnich i Małych Spółek (NN FIO)	230,07	PLN	0,31	0,56	0,99	1,54	26,91	46,36	2017-07-26	
NN Stabilnego Wzrostu (NN FIO)	275,42	PLN	0,16	-0,07	0,49	0,73	10,00	9,26	2017-07-26	
NN Zrównoważony (NN FIO)	336,46	PLN	0,27	0,02	0,97	0,72	16,47	16,45	2017-07-26	
Noble Fund Africa and Frontier (Noble Funds SFIO)	53,24	PLN	0,64	0,81	7,23	3,26	11,68	-22,06	2017-07-26	-
Noble Fund Akcji (Noble Funds FIO)	144,93	PLN	0,83	0,06	0,85	-0,54	27,64	13,00	2017-07-26	
Noble Fund Akcji Małych i Średnich Spółek (Noble Funds FIO)	115,02	PLN	0,52	0,18	-0,26	1,47	27,11	35,24	2017-07-26	
Noble Fund Akumulacji Kapitału FIZ	1 078,39	PLN	0,00	0,00	0,33	0,49	5,41	0,00	2017-07-26	-
Noble Fund Dywidendowy FIZ	93,32	PLN	0,00	0,00	-0,56	3,74	9,98	0,00	2017-07-26	
Noble Fund Global Return (Noble Funds FIO)	126,75	PLN	0,52	-0,52	1,42	2,95	12,17	4,65	2017-07-26	-
Noble Fund Long Short FIZ	871,41	PLN	0,00	0,00	-0,03	0,81	-1,59	0,00	2017-07-26	-
Noble Fund Mieszany (Noble Funds FIO)	155,78	PLN	0,39	-0,07	0,01	0,50	11,74	12,47	2017-07-26	
Noble Fund Obligacji (Noble Funds FIO)	108,66	PLN	0,00	-0,02	0,06	0,58	0,64	6,07	2017-07-26	
Noble Fund Opportunity FIZ	1 433,37	PLN	0,00	0,00	-1,13	1,78	21,13	0,00	2017-07-26	-
Noble Fund Pieniężny (Noble Funds FIO)	140,23	PLN	0,01	0,04	0,22	0,83	2,47	5,33	2017-07-26	
Noble Fund Stabilnego Wzrostu Plus (Noble Funds FIO)	153,47	PLN	0,36	-0,08	0,35	0,20	8,68	11,91	2017-07-26	
Noble Fund Timingowy (Noble Funds FIO)	162,86	PLN	0,79	0,01	1,84	-0,82	12,50	17,06	2017-07-26	
Novo Akcji (Novo FIO)	210,73	PLN	0,95	-0,62	3,39	4,86	46,05	-2,30	2017-07-26	
Novo Aktywnej Alokacji (Novo FIO)	107,56	PLN	0,66	-0,60	2,37	2,94	26,51	9,21	2017-07-26	
Novo Globalnego Dochodu (Novo FIO)	106,67	PLN	0,01	-0,01	0,40	1,48	0,00	0,00	2017-07-26	-
Novo Gotówkowy (Novo FIO)	139,85	PLN	0,00	-0,01	-0,29	0,87	-0,29	3,78	2017-07-26	
Novo Małych i Średnich Spółek (Novo FIO)	100,12	PLN	0,21	-0,09	0,05	0,00	0,00	0,00	2017-07-26	-
Novo Obligacji Przedsiębiorstw (Novo FIO)	229,28	PLN	0,04	0,01	-0,31	-0,53	-0,32	3,22	2017-07-26	
Novo Papierów Dłużnych (Novo FIO)	197,19	PLN	0,01	-0,11	-0,78	-0,70	-3,35	0,31	2017-07-26	
Novo Primum Ochrony Kapitału (Novo Primum FIZ)	101,98	PLN	0,00	-0,19	-0,71	-0,13	0,00	0,00	2017-07-26	-
Novo Rentier FIZ	947,19	PLN	0,00	0,21	-0,08	0,09	-1,30	0,00	2017-07-26	-
Novo Stabilnego Wzrostu (Novo FIO)	215,09	PLN	0,24	-0,35	1,34	0,40	18,68	3,93	2017-07-26	
Novo Zrównoważonego Wzrostu (Novo FIO)	196,73	PLN	0,44	-0,69	3,01	3,50	31,59	0,48	2017-07-26	
Obligo NSFIZ	217 750,00	PLN	0,00	0,00	0,93	2,18	0,00	0,00	2017-07-26	-
Open Finance Absolute Return FIZ	1 373,65	PLN	0,00	0,00	-1,11	-1,11	25,10	0,00	2017-07-26	-
Open Finance Akcji (Open Finance FIO)	119,70	PLN	0,04	-0,75	1,29	0,55	20,00	6,21	2017-07-25	
Open Finance Akcji Małych i Średnich Spółek (Open Finance FIO)	166,75	PLN	0,03	-0,15	1,00	1,65	23,52	38,31	2017-07-25	
Open Finance Aktywnej Alokacji (Open Finance FIO)	95,72	PLN	-0,04	-0,11	0,27	-0,17	-0,23	-8,08	2017-07-25	
Open Finance Obligacji (Open Finance FIO)	109,89	PLN	-0,11	-0,25	-0,07	0,41	0,87	1,09	2017-07-25	
Open Finance Obligacji Korporacyjnych Europy Środkowej i Wschodniej FIZ AN	1 090,09	PLN	0,00	0,00	0,26	1,07	4,88	0,00	2017-07-21	
Open Finance Obligacji Przedsiębiorstw FIZ AN seria C	1 168,48	PLN	0,00	0,00	0,31	1,26	6,18	0,00	2017-07-24	
Open Finance Obligacji Przedsiębiorstw Rentier FIZ	102,84	PLN	0,00	0,36	-0,84	-0,02	3,32	0,00	2017-07-26	-
Open Finance Pieniężny (Open Finance FIO)	114,94	PLN	-0,12	-0,16	0,03	0,35	1,34	5,59	2017-07-25	
Open Finance Stabilnego Wzrostu (Open Finance FIO)	110,94	PLN	-0,03	-0,43	0,04	-0,47	2,30	-2,59	2017-07-25	
Open Finance Surowcowy FIZ	96,59	PLN	0,00	0,00	-0,59	-1,45	-8,69	5,98	2017-07-26	-
Opera Alfa-plus.pl (Opera SFIO)	17,54	PLN	0,00	0,69	1,92	4,90	19,16	13,67	2017-07-25	-
Opera Avista-plus.pl (Opera SFIO)	15,94	PLN	0,00	0,19	-0,25	0,00	-1,73	4,52	2017-07-25	-
Opera Avista.pl (Opera FIO)	18,19	PLN	0,00	-0,05	-0,66	0,44	-2,10	2,54	2017-07-26	
Opera Equilibrium.pl (Opera FIO)	13,09	PLN	0,38	-0,46	3,31	4,80	26,60	-1,06	2017-07-26	
Opera FIZ	39 303,70	PLN	0,00	0,00	2,50	1,77	2,70	0,00	2017-07-26	-
Opera NGO SFIO	13,48	PLN	0,00	-0,15	0,97	1,58	27,77	27,41	2017-07-26	
Opera Pecunia.pl (Opera FIO)	12,73	PLN	0,00	-0,08	-0,16	0,63	0,08	3,83	2017-07-26	
Opera Tutus-plus (Opera SFIO)	12,43	PLN	0,00	0,32	0,00	0,40	1,30	5,61	2017-07-25	
Opera Universa.pl (Opera FIO)	8,63	PLN	0,58	-1,03	6,41	9,38	43,12	-10,94	2017-07-26	-
Opera Za 3 Grosze FIZ	336,50	PLN	0,00	0,00	0,95	8,79	39,92	0,00	2017-07-26	-
Opoka Alfa (Opoka Omega FIZ)	115,88	PLN	0,00	0,00	-0,22	-0,32	7,21	0,00	2017-07-26	-
Opoka Neutral (Opoka Omega FIZ)	117,93	PLN	0,00	0,00	0,40	0,16	4,54	0,00	2017-07-26	-
Opoka One FIZ	161,81	PLN	0,00	0,00	-0,33	-0,33	9,11	0,00	2017-07-26	-
Opoka Quant (Opoka Omega FIZ)	102,66	PLN	0,00	0,00	-1,44	-0,39	0,00	0,00	2017-07-26	-
Opoka Ultra (Opoka Omega FIZ)	124,57	PLN	0,00	0,00	-0,27	1,86	0,00	0,00	2017-07-26	-
OPTI Absolute Return FIZ	1 066,77	PLN	0,00	0,00	0,05	0,31	3,77	0,00	2017-07-26	-
OPTI FIZ	1 229,60	PLN	0,00	0,00	-0,15	1,98	13,35	16,47	2017-07-26	
OPTI Płynnych Obligacji FIZ	1 097,04	PLN	0,00	0,14	0,45	1,47	4,89	0,00	2017-07-26	
Optimum Akcji (Optimum FIO)	9,63	PLN	0,31	-0,72	1,48	1,37	28,74	-1,93	2017-07-25	
Optimum Gotówkowy (Optimum FIO)	9,96	PLN	0,00	0,00	-0,20	-0,30	-1,68	-2,16	2017-07-25	
Optimum Obligacji (Optimum FIO)	10,07	PLN	0,00	0,00	-0,10	0,10	-2,42	-2,14	2017-07-25	
PEM FIZ - Private Equity Multifund FIZ	103,64	PLN	0,00	0,00	1,60	1,82	0,00	0,00	2017-07-26	-
Pioneer Akcji - Aktywna Selekcja (Pioneer FIO)	11,08	PLN	0,27	-0,18	1,47	1,56	25,62	4,04	2017-07-25	
Pioneer Akcji Amerykańskich (Pioneer Walutowy FIO)	109,24	PLN	0,75	0,95	-1,47	-3,57	2,71	30,56	2017-07-25	
Pioneer Akcji Amerykańskich (USD) (Pioneer Walutowy FIO)	29,91	USD	0,40	0,81	2,05	2,64	11,65	10,21	2017-07-25	-
Pioneer Akcji Europejskich (EUR) (Pioneer Walutowy FIO)	11,87	EUR	0,25	-0,17	-1,74	-0,92	11,35	11,46	2017-07-25	-
Pioneer Akcji Europejskich (Pioneer Walutowy FIO)	50,52	PLN	0,58	1,06	-1,04	-0,37	8,74	14,40	2017-07-25	
Pioneer Akcji Małych i Średnich Spółek Rynków Rozwiniętych (Pioneer Funduszy Globalnych SFIO)	12,15	PLN	0,25	-0,08	-0,65	0,08	12,81	17,16	2017-07-25	-
Pioneer Akcji Polskich (Pioneer FIO)	23,64	PLN	0,17	-0,34	1,03	0,77	23,70	1,11	2017-07-25	
Pioneer Akcji Rynków Dalekiego Wschodu (Pioneer Funduszy Globalnych SFIO)	10,12	PLN	-0,30	0,60	4,01	9,41	20,05	11,45	2017-07-25	
Pioneer Akcji Rynków Wschodzących (Pioneer Funduszy Globalnych SFIO)	7,71	PLN	0,39	1,31	5,47	9,05	25,57	-5,40	2017-07-25	
Pioneer Alternatywny - Absolutnej Stopy Zwrotu (Pioneer Funduszy Globalnych SFIO)	10,53	PLN	0,00	-0,09	0,19	0,57	3,24	0,00	2017-07-25	-
Pioneer Alternatywny - Globalnego Dochodu (Pioneer Funduszy Globalnych SFIO)	10,44	PLN	0,19	0,10	0,10	0,97	5,99	0,00	2017-07-25	-
Pioneer Dochodu i Wzrostu Regionu Pacyfiku (Pioneer Funduszy Globalnych SFIO)	15,99	PLN	-0,25	0,13	1,72	4,99	11,35	9,90	2017-07-25	-
Pioneer Dochodu i Wzrostu Rynku Chińskiego (Pioneer Funduszy Globalnych SFIO)	17,51	PLN	-0,17	0,52	3,00	6,19	12,97	10,61	2017-07-25	-
Pioneer Dochodu USD (Pioneer Funduszy Globalnych SFIO)	9,62	PLN	0,21	0,10	-3,22	-5,03	-5,87	0,00	2017-07-25	-
Pioneer Dochodu USD (USD) (Pioneer Funduszy Globalnych SFIO)	2,63	USD	-0,38	-0,38	0,00	0,77	2,33	0,00	2017-07-25	-
Pioneer Dynamicznych Spółek (Pioneer FIO)	21,64	PLN	0,14	-0,09	-0,18	1,31	23,16	29,27	2017-07-25	
Pioneer Elastycznego Inwestowania (Pioneer Strategie Funduszowe SFIO)	11,80	PLN	0,00	0,17	1,55	2,16	5,92	1,55	2017-07-25	
Pioneer Global Multi-Asset Target Income FIZ	966,63	PLN	0,00	0,07	0,08	0,46	1,55	0,00	2017-07-25	
Pioneer Gotówkowy (Pioneer Funduszy Globalnych SFIO)	12,22	PLN	0,00	0,00	0,16	0,58	1,66	4,62	2017-07-25	
Pioneer Konsumpcji i Wzrostu Rynków Wschodzących FIZ	1 093,91	PLN	-0,10	-0,49	-1,55	-0,27	9,50	0,00	2017-07-25	
Pioneer Małych i Średnich Spółek Rynku Polskiego (Pioneer FIO)	11,28	PLN	0,09	-0,18	0,00	1,71	26,74	24,64	2017-07-25	
Pioneer Obligacji - Dynamiczna Alokacja 2 (Pioneer FIO)	11,95	PLN	-0,08	0,00	-0,17	0,84	1,10	7,27	2017-07-25	
Pioneer Obligacji - Dynamiczna Alokacja FIO	138,34	PLN	-0,05	-0,02	-0,12	0,83	1,17	7,18	2017-07-25	
Pioneer Obligacji Dolarowych Plus (Pioneer Walutowy FIO)	73,28	PLN	0,29	0,26	-2,75	-4,76	-5,41	18,37	2017-07-25	-
Pioneer Obligacji Dolarowych Plus (USD) (Pioneer Walutowy FIO)	20,07	USD	-0,05	0,15	0,75	1,41	2,82	-0,05	2017-07-25	-
Pioneer Obligacji Europejskich Plus (EUR) (Pioneer Walutowy FIO)	10,54	EUR	-0,09	0,00	-0,38	-0,47	-1,40	-0,57	2017-07-25	-
Pioneer Obligacji Europejskich Plus (Pioneer Walutowy FIO)	44,86	PLN	0,29	1,22	0,31	0,02	-3,73	2,07	2017-07-25	-
Pioneer Obligacji i Dochodu (Pioneer Funduszy Globalnych SFIO)	11,53	PLN	0,00	-0,09	0,09	0,26	4,91	15,07	2017-07-25	
Pioneer Obligacji Plus (Pioneer FIO)	57,01	PLN	-0,05	-0,04	0,07	1,01	1,19	5,09	2017-07-25	
Pioneer Obligacji Strategicznych (Pioneer Funduszy Globalnych SFIO)	18,44	PLN	-0,05	0,05	0,44	0,66	3,71	6,53	2017-07-25	
Pioneer Pieniężny (Pioneer FIO)	190,11	PLN	0,01	0,04	0,16	0,50	1,48	4,42	2017-07-25	
Pioneer Pieniężny Plus (Pioneer FIO)	10,85	PLN	0,00	0,09	0,09	0,46	1,31	5,54	2017-07-25	
Pioneer Stabilnego Inwestowania (Pioneer FIO)	12,16	PLN	0,00	-0,25	0,08	0,66	7,42	2,27	2017-07-25	
Pioneer Stabilnego Wzrostu (Pioneer FIO)	200,47	PLN	0,02	-0,16	0,42	1,23	8,30	3,51	2017-07-25	
Pioneer Strategii Globalnej (Pioneer Strategie Funduszowe SFIO)	18,98	PLN	-0,05	0,11	-0,21	0,48	4,52	10,03	2017-07-25	-
Pioneer Strategii Globalnej - dynamiczny (Pioneer Strategie Funduszowe SFIO)	10,29	PLN	0,39	0,49	0,49	1,38	0,00	0,00	2017-07-25	-
Pioneer Strategii Globalnej - konserwatywny (Pioneer Strategie Funduszowe SFIO)	10,93	PLN	-0,09	0,18	-0,27	0,74	3,11	0,00	2017-07-25	-
Pioneer Surowców i Energii (Pioneer Funduszy Globalnych SFIO)	5,68	PLN	-0,53	-0,70	-0,53	-5,33	-7,49	-27,27	2017-07-25	-
Pioneer Wzrostu i Dochodu Rynku Amerykańskiego (Pioneer Funduszy Globalnych SFIO)	11,21	PLN	0,09	0,36	1,08	1,45	6,97	0,00	2017-07-25	-
Pioneer Wzrostu i Dochodu Rynku Europejskiego (Pioneer Funduszy Globalnych SFIO)	11,84	PLN	0,08	0,00	-0,67	-0,08	8,72	12,02	2017-07-25	-
Pioneer Zabezpieczony Rynku Polskiego (Pioneer Strategie Funduszowe SFIO)	11,30	PLN	0,00	0,00	0,18	0,53	0,80	0,89	2017-07-25	-
Pioneer Zmiennej Alokacji (Pioneer Strategie Funduszowe SFIO)	12,64	PLN	0,00	0,00	0,32	0,96	-0,16	-1,02	2017-07-25	-
Pioneer Zmiennej Alokacji - Rynki Wschodzące (Pioneer Strategie Funduszowe SFIO)	9,77	PLN	0,00	0,00	0,83	0,83	2,30	-1,91	2017-07-25	-
Pioneer Zmiennej Alokacji Rynku Amerykańskiego (Pioneer Strategie Funduszowe SFIO)	12,94	PLN	0,00	0,00	0,23	0,78	1,25	4,69	2017-07-25	-
Pioneer Zrównoważony (Pioneer FIO)	124,23	PLN	0,19	-0,31	0,67	0,98	14,72	2,69	2017-07-25	
Pioneer Zrównoważony Rynku Amerykańskiego (Pioneer Walutowy FIO)	52,55	PLN	0,61	0,69	-1,96	-4,58	-1,39	25,21	2017-07-25	
Pioneer Zrównoważony Rynku Amerykańskiego (USD) (Pioneer Walutowy FIO)	14,39	USD	0,28	0,56	1,55	1,55	7,23	5,73	2017-07-25	-
PKO Absolutnej Stopy Zwrotu Europa Wschód-Zachód FIZ	100,03	PLN	0,00	0,00	0,26	0,26	0,00	0,00	2017-07-26	-
PKO Akcji Dywidendowych Globalny (Parasolowy FIO)	116,15	PLN	0,23	-0,44	-1,83	-0,48	11,85	0,00	2017-07-26	
PKO Akcji Dywidendowych Globalny A1 (Parasolowy FIO)	117,74	PLN	0,24	-0,42	-1,78	-0,30	12,70	0,00	2017-07-26	-
PKO Akcji Małych i Średnich Spółek (Parasolowy FIO)	268,15	PLN	0,30	0,05	-0,35	1,31	22,10	36,95	2017-07-26	
PKO Akcji Małych i Średnich Spółek A1 (Parasolowy FIO)	278,40	PLN	0,30	0,07	-0,27	1,56	23,33	41,13	2017-07-26	-
PKO Akcji Nowa Europa (Parasolowy FIO)	116,54	PLN	0,47	0,30	2,96	1,60	18,53	19,77	2017-07-26	
PKO Akcji Nowa Europa A1 (Parasolowy FIO)	129,03	PLN	0,47	0,33	3,05	1,86	19,73	23,41	2017-07-26	-
PKO Akcji Plus (Parasolowy FIO)	95,99	PLN	0,37	-0,04	1,05	2,26	24,78	25,33	2017-07-26	
PKO Akcji Plus A1 (Parasolowy FIO)	99,94	PLN	0,37	-0,02	1,13	2,50	26,03	29,15	2017-07-26	-
PKO Akcji Rynków Wschodzących (Parasolowy FIO)	98,95	PLN	0,13	0,17	3,23	5,76	13,31	0,00	2017-07-26	
PKO Akcji Rynków Wschodzących A1 (Parasolowy FIO)	100,89	PLN	0,14	0,20	3,32	6,03	14,45	0,00	2017-07-26	-
PKO Akcji Rynku Amerykańskiego (Parasolowy FIO)	105,60	PLN	-0,12	0,28	0,54	0,87	6,23	0,00	2017-07-26	
PKO Akcji Rynku Amerykańskiego A1 (Parasolowy FIO)	107,65	PLN	-0,12	0,29	0,63	1,13	7,29	0,00	2017-07-26	-
PKO Akcji Rynku Azji i Pacyfiku (Parasolowy FIO)	103,12	PLN	0,25	0,36	2,75	5,85	13,19	0,00	2017-07-26	
PKO Akcji Rynku Azji i Pacyfiku A1 (Parasolowy FIO)	105,13	PLN	0,26	0,38	2,85	6,13	14,32	0,00	2017-07-26	-
PKO Akcji Rynku Europejskiego (Parasolowy FIO)	98,24	PLN	0,34	-0,05	-1,18	-0,48	14,59	0,00	2017-07-26	
PKO Akcji Rynku Europejskiego A1 (Parasolowy FIO)	99,83	PLN	0,33	-0,05	-1,12	-0,29	15,45	0,00	2017-07-26	-
PKO Akcji Rynku Japońskiego (Parasolowy FIO)	89,66	PLN	0,00	0,15	-0,93	2,46	13,06	0,00	2017-07-26	-
PKO Akcji Rynku Japońskiego A1 (Parasolowy FIO)	91,40	PLN	-0,01	0,16	-0,85	2,71	14,18	0,00	2017-07-26	-
PKO Akcji Rynku Złota (Parasolowy FIO)	110,70	PLN	2,77	1,54	-3,22	-3,29	-26,17	0,00	2017-07-26	-
PKO Akcji Rynku Złota A1 (Parasolowy FIO)	111,82	PLN	2,77	1,54	-3,18	-3,18	-25,80	0,00	2017-07-26	-
PKO Bezpieczna Lokata I FIZ	109,18	PLN	0,00	0,00	1,20	1,20	3,49	0,00	2017-07-26	-
PKO Dóbr Luksusowych Globalny (Parasolowy FIO)	187,57	PLN	0,04	-0,23	0,46	2,22	20,70	37,58	2017-07-26	-
PKO Dóbr Luksusowych Globalny A1 (Parasolowy FIO)	194,56	PLN	0,05	-0,22	0,54	2,48	21,91	41,76	2017-07-26	-
PKO Europa Wschód-Zachód FIZ seria A	110,52	PLN	0,00	0,00	-0,26	0,36	1,69	0,00	2017-07-26	-
PKO Europa Wschód-Zachód FIZ seria B	111,12	PLN	0,00	0,00	-0,25	0,37	1,69	0,00	2017-07-26	-
PKO Europa Wschód-Zachód FIZ seria C	108,57	PLN	0,00	0,00	-0,26	0,37	1,70	0,00	2017-07-26	-
PKO Europa Wschód-Zachód FIZ seria D	110,09	PLN	0,00	0,00	-0,25	0,36	1,69	0,00	2017-07-26	-
PKO Europa Wschód-Zachód FIZ seria E	109,57	PLN	0,00	0,00	-0,25	0,37	1,70	0,00	2017-07-26	-
PKO Europa Wschód-Zachód FIZ seria F	110,39	PLN	0,00	0,00	-0,26	0,36	1,70	0,00	2017-07-26	-
PKO Europa Wschód-Zachód FIZ seria G	109,16	PLN	0,00	0,00	-0,26	0,37	0,00	0,00	2017-07-26	-
PKO Europa Wschód-Zachód FIZ seria H	110,68	PLN	0,00	0,00	-0,25	0,37	0,00	0,00	2017-07-26	-
PKO Europa Wschód-Zachód FIZ seria I	110,71	PLN	0,00	0,00	-0,25	0,34	0,00	0,00	2017-07-26	-
PKO Globalnego Dochodu FIZ	105,84	PLN	0,00	0,00	-0,31	0,95	2,85	0,00	2017-07-26	-
PKO Globalnej Makroekonomii FIZ seria A	1 351,68	PLN	0,00	0,00	0,52	-1,82	-1,93	0,00	2017-07-26	-
PKO Globalnej Makroekonomii FIZ seria B	1 314,69	PLN	0,00	0,00	0,52	-1,82	-2,17	0,00	2017-07-26	-
PKO Globalnej Makroekonomii FIZ seria C	1 328,54	PLN	0,00	0,00	0,52	-1,82	-2,17	0,00	2017-07-26	-
PKO Globalnej Makroekonomii FIZ seria D	1 314,33	PLN	0,00	0,00	0,52	-1,82	-2,17	0,00	2017-07-26	-
PKO Globalnej Makroekonomii FIZ seria E	1 327,74	PLN	0,00	0,00	0,52	-1,82	-2,17	0,00	2017-07-26	-
PKO Globalnej Makroekonomii FIZ seria F	1 348,76	PLN	0,00	0,00	0,52	-1,82	-2,17	0,00	2017-07-26	-
PKO Globalnej Makroekonomii FIZ seria G	1 336,53	PLN	0,00	0,00	0,52	-1,82	-2,17	0,00	2017-07-26	-
PKO Globalnej Makroekonomii FIZ seria H	1 352,32	PLN	0,00	0,00	0,52	-1,82	-2,17	0,00	2017-07-26	-
PKO Globalnej Makroekonomii FIZ seria I	1 362,19	PLN	0,00	0,00	0,52	-1,82	-2,18	0,00	2017-07-26	-
PKO Globalnej Makroekonomii FIZ seria J	1 326,78	PLN	0,00	0,00	0,52	-1,82	-2,22	0,00	2017-07-26	-
PKO Globalnej Makroekonomii FIZ seria K	1 345,49	PLN	0,00	0,00	0,52	-1,82	-2,24	0,00	2017-07-26	-
PKO Globalnej Makroekonomii FIZ seria L	1 348,31	PLN	0,00	0,00	0,52	-1,82	0,00	0,00	2017-07-26	-
PKO Globalnej Makroekonomii FIZ seria M	1 341,54	PLN	0,00	0,00	0,52	-1,82	0,00	0,00	2017-07-26	-
PKO Globalnej Makroekonomii FIZ seria N	1 366,25	PLN	0,00	0,00	0,52	-1,82	0,00	0,00	2017-07-26	-
PKO Globalnej Makroekonomii FIZ seria O	1 350,09	PLN	0,00	0,00	0,52	-1,82	0,00	0,00	2017-07-26	-
PKO Globalnej Strategii FIZ	104,83	PLN	0,00	0,00	-1,72	-1,89	-2,03	0,00	2017-07-26	-
PKO Infrastruktury i Budownictwa Globalny (Parasolowy FIO)	99,33	PLN	0,35	-1,14	-1,96	-0,92	15,18	22,28	2017-07-26	-
PKO Infrastruktury i Budownictwa Globalny A1 (Parasolowy FIO)	103,45	PLN	0,36	-1,12	-1,88	-0,65	16,33	26,00	2017-07-26	-
PKO Medycyny i Demografii Globalny (Parasolowy FIO)	113,09	PLN	0,07	0,38	-0,73	4,89	0,00	0,00	2017-07-26	-
PKO Medycyny i Demografii Globalny A1 (Parasolowy FIO)	113,91	PLN	0,08	0,41	-0,65	5,14	0,00	0,00	2017-07-26	-
PKO Multi Strategia FIZ seria A	109,25	PLN	0,00	0,00	-0,43	0,77	6,35	0,00	2017-07-26	
PKO Multi Strategia FIZ seria B	110,18	PLN	0,00	0,00	-0,43	0,77	6,35	0,00	2017-07-26	-
PKO Multi Strategia FIZ seria C	110,08	PLN	0,00	0,00	-0,43	0,77	6,35	0,00	2017-07-26	-
PKO Multi Strategia FIZ seria D	109,82	PLN	0,00	0,00	-0,43	0,77	6,35	0,00	2017-07-26	-
PKO Multi Strategia FIZ seria E	108,36	PLN	0,00	0,00	-0,43	0,76	0,00	0,00	2017-07-26	-
PKO Multi Strategia FIZ seria F	109,17	PLN	0,00	0,00	-0,43	0,77	0,00	0,00	2017-07-26	-
PKO Multi Strategia FIZ seria G	107,73	PLN	0,00	0,00	-0,43	0,77	0,00	0,00	2017-07-26	-
PKO Multi Strategia FIZ seria H	108,41	PLN	0,00	0,00	-0,43	0,00	0,00	0,00	2017-07-26	-
PKO Nieruchomości Komercyjnych FIZ AN	10,56	PLN	0,00	0,00	0,38	0,38	4,14	0,00	2017-07-26	-
PKO Obligacji Długoterminowych (Parasolowy FIO)	206,40	PLN	-0,04	-0,00	-0,01	1,48	2,03	7,17	2017-07-26	
PKO Obligacji Długoterminowych A1 (Parasolowy FIO)	211,52	PLN	-0,04	0,00	0,00	1,54	2,23	8,22	2017-07-26	-
PKO Papierów Dłużnych Plus (Parasolowy FIO)	167,09	PLN	-0,01	0,05	0,13	1,22	1,97	5,21	2017-07-26	
PKO Papierów Dłużnych Plus A1 (Parasolowy FIO)	170,64	PLN	-0,02	0,05	0,14	1,27	2,17	6,24	2017-07-26	-
PKO Papierów Dłużnych USD (Parasolowy FIO)	105,65	PLN	0,38	0,46	-3,09	-4,35	-6,77	0,00	2017-07-26	-
PKO Papierów Dłużnych USD A1 (Parasolowy FIO)	105,95	PLN	0,38	0,46	-3,09	-4,33	-6,68	0,00	2017-07-26	-
PKO Płynnościowy SFIO	11,59	PLN	0,00	0,09	0,35	1,05	2,48	7,22	2017-07-26	
PKO Płynnościowy SFIO A1	11,69	PLN	0,00	0,09	0,34	1,12	2,63	7,84	2017-07-26	-
PKO Rynku Pieniężnego (Parasolowy FIO)	1 457,38	PLN	0,00	0,02	0,10	0,49	1,54	4,24	2017-07-26	-
PKO Rynku Pieniężnego A1 (Parasolowy FIO)	1 475,27	PLN	0,00	0,03	0,11	0,51	1,65	4,56	2017-07-26	-
PKO Skarbowy (Parasolowy FIO)	2 144,45	PLN	0,01	0,07	0,30	0,88	2,33	5,86	2017-07-26	
PKO Skarbowy A1 (Parasolowy FIO)	2 196,92	PLN	0,01	0,07	0,31	0,91	2,45	6,20	2017-07-26	-
PKO Spółek Innowacyjnych Globalny FIZ seria A	158,13	PLN	0,00	0,00	-1,29	3,82	31,65	0,00	2017-07-26	
PKO Spółek Innowacyjnych Globalny FIZ seria B	148,66	PLN	0,00	0,00	-1,29	3,82	31,60	0,00	2017-07-26	-
PKO Spółek Innowacyjnych Globalny FIZ seria C	158,51	PLN	0,00	0,00	-1,29	3,82	31,74	0,00	2017-07-26	-
PKO Spółek Innowacyjnych Globalny FIZ seria D	148,18	PLN	0,00	0,00	-0,76	4,44	0,00	0,00	2017-07-26	-
PKO Spółek Innowacyjnych Globalny FIZ seria E	152,20	PLN	0,00	0,00	-0,75	4,45	0,00	0,00	2017-07-26	-
PKO Stabilnego Wzrostu (Parasolowy FIO)	162,09	PLN	0,10	0,01	0,38	1,65	9,46	11,43	2017-07-26	
PKO Stabilnego Wzrostu A1 (Parasolowy FIO)	173,43	PLN	0,11	0,02	0,42	1,78	10,01	13,12	2017-07-26	-
PKO Strategicznej Alokacji (Parasolowy FIO)	100,71	PLN	0,27	0,32	0,91	0,60	11,31	14,98	2017-07-26	
PKO Strategicznej Alokacji A1 (Parasolowy FIO)	100,71	PLN	0,27	0,32	0,60	0,46	11,31	14,98	2017-07-26	-
PKO Strategii Dłużnych FIZ seria A	122,47	PLN	0,00	0,00	0,48	0,48	1,26	0,00	2017-07-26	-
PKO Strategii Dłużnych FIZ seria B	122,02	PLN	0,00	0,00	0,49	0,48	1,26	0,00	2017-07-26	-
PKO Strategii Dłużnych FIZ seria C	121,50	PLN	0,00	0,00	0,49	0,48	1,26	0,00	2017-07-26	-
PKO Strategii Dłużnych FIZ seria D	122,76	PLN	0,00	0,00	0,48	0,47	1,25	0,00	2017-07-26	-
PKO Strategii Dłużnych FIZ seria E	122,12	PLN	0,00	0,00	0,49	0,48	1,26	0,00	2017-07-26	-
PKO Strategii Dłużnych FIZ seria F	122,35	PLN	0,00	0,00	0,48	0,48	1,26	0,00	2017-07-26	-
PKO Strategii Dłużnych FIZ seria G	121,89	PLN	0,00	0,00	0,49	0,48	1,25	0,00	2017-07-26	-
PKO Strategii Dłużnych FIZ seria H	122,47	PLN	0,00	0,00	0,48	0,48	1,26	0,00	2017-07-26	-
PKO Strategii Dłużnych FIZ seria I	122,14	PLN	0,00	0,00	0,49	0,48	0,00	0,00	2017-07-26	-
PKO Strategii Dłużnych FIZ seria J	122,38	PLN	0,00	0,00	0,48	0,48	0,00	0,00	2017-07-26	-
PKO Strategii Dłużnych FIZ seria K	122,60	PLN	0,00	0,00	0,48	0,48	0,00	0,00	2017-07-26	-
PKO Strategii Dłużnych FIZ seria L	122,61	PLN	0,00	0,00	0,49	0,48	0,00	0,00	2017-07-26	-
PKO Strategii Dłużnych FIZ seria M	122,44	PLN	0,00	0,00	0,49	0,48	0,00	0,00	2017-07-26	-
PKO Strategii Obligacyjnych FIZ	106,95	PLN	0,00	0,00	0,39	0,46	1,43	0,00	2017-07-26	-
PKO Surowców Globalny (Parasolowy FIO)	116,24	PLN	1,25	0,79	3,36	-0,49	0,82	22,85	2017-07-26	-
PKO Surowców Globalny A1 (Parasolowy FIO)	120,56	PLN	1,24	0,79	3,44	-0,25	1,82	26,57	2017-07-26	-
PKO Technologii i Innowacji Globalny (Parasolowy FIO)	235,76	PLN	0,29	0,27	1,25	5,91	26,43	60,10	2017-07-26	-
